{
  "specVersion": "0.1.0",
  "id": "urn:srcos:agent-machine:activation-decision:local-llama-cpp-allowed",
  "kind": "ActivationDecision",
  "decision": {
    "status": "allowed",
    "activationAllowed": true,
    "reason": "activation allowed",
    "failureReasons": [],
    "requiredBeforeActivation": []
  },
  "inputs": {
    "agentPodId": "urn:srcos:agent-machine:agent-pod:local-podman-llama-cpp",
    "agentMachineId": "urn:srcos:agent-machine:m2-asahi-local",
    "providerId": "urn:srcos:agent-machine:inference-provider:asahi-llama-cpp",
    "policyAdmissionId": "urn:srcos:agent-machine:policy-admission:allowed-loopback-activation",
    "agentRegistryGrantId": "urn:srcos:agent-machine:agent-registry-grant:active-loopback-activation",
    "deploymentReceiptId": "urn:srcos:agent-machine:deployment-receipt:aaaaaaaaaaaaaaaaaaaaaaaaaaaaaaaa",
    "storageReceiptRefs": [
      "urn:srcos:agent-machine:storage-receipt:local-lvm-warm-cache"
    ]
  },
  "scope": {
    "runtimeMode": "podman-quadlet",
    "networkExposure": [
      "loopback"
    ],
    "sideEffects": [
      "emit-runtime-receipt",
      "emit-storage-receipt",
      "mount-cache",
      "start-provider"
    ],
    "toolRefs": [
      "urn:srcos:tool:emit-runtime-receipt",
      "urn:srcos:tool:emit-storage-receipt",
      "urn:srcos:tool:mount-cache",
      "urn:srcos:tool:start-provider"
    ],
    "storageScopeRefs": [
      "urn:srcos:agent-machine:storage-receipt:local-lvm-warm-cache"
    ],
    "cacheReuseAllowed": false
  },
  "obligations": {
    "requiredReceipts": [
      "deployment",
      "runtime",
      "storage"
    ],
    "policyDecisionRef": "urn:srcos:policy-decision:allowed-loopback-activation",
    "agentRegistryGrantRef": "urn:srcos:agent-registry-grant:active-loopback-activation",
    "expiresAt": "2026-05-04T13:50:00Z",
    "revocationRefs": [
      "urn:srcos:revocation:active-loopback-activation",
      "urn:srcos:revocation:policy-allowed-loopback-activation"
    ]
  },
  "receiptSafety": {
    "includeRawContent": false,
    "rawPromptContentIncluded": false,
    "rawKvCacheContentIncluded": false,
    "secretValuesIncluded": false,
    "privateMemoryIncluded": false
  },
  "decidedAt": "2026-05-04T12:51:00Z",
  "labels": {
    "sourceos.activation.prototype": "true",
    "sourceos.activation.allowed": "true",
    "sourceos.activation.fail-closed": "false"
  }
}
